[
  {
    "round_id": "r1-specify-parallel-worktree-execution",
    "phase": "specify",
    "started_at": "2026-09-26T12:21:55Z",
    "ended_at": "2026-09-26T12:21:55Z",
    "duration_seconds": 0.0,
    "input_tokens": 0,
    "output_tokens": 0,
    "total_tokens": 0,
    "work_packages_completed": 0,
    "features_completed": 0,
    "tokens_per_minute": 0.0,
    "packages_per_hour": 0.0,
    "features_per_hour": 0.0,
    "notes": "adapter (Claude Code) does not expose token accounting to this session; token fields recorded as 0 per protocol"
  },
  {
    "round_id": "r2-clarify-parallel-worktree-execution",
    "phase": "clarify",
    "started_at": "2026-09-26T12:25:51.489017+00:00",
    "ended_at": "2026-09-26T12:25:51.489017+00:00",
    "duration_seconds": 0.0,
    "input_tokens": 0,
    "output_tokens": 0,
    "total_tokens": 0,
    "work_packages_completed": 0,
    "features_completed": 0,
    "tokens_per_minute": 0.0,
    "packages_per_hour": 0.0,
    "features_per_hour": 0.0,
    "notes": "adapter (Claude Code) does not expose token accounting to this session; token fields recorded as 0 per protocol. No spec changes: zero critical ambiguities found, one non-blocking item deferred to planning."
  },
  {
    "round_id": "r3-plan-parallel-worktree-execution",
    "phase": "plan",
    "started_at": "2026-09-26T12:27:52.679373+00:00",
    "ended_at": "2026-09-26T12:27:52.696263+00:00",
    "duration_seconds": 0.017,
    "input_tokens": 0,
    "output_tokens": 0,
    "total_tokens": 0,
    "work_packages_completed": 0,
    "features_completed": 0,
    "tokens_per_minute": 0.0,
    "packages_per_hour": 0.0,
    "features_per_hour": 0.0,
    "notes": "adapter does not expose token accounting; recorded 0 per protocol. Generated research.md, data-model.md, contracts/cli-worktree.md, quickstart.md, plan.md; Constitution Check all PASS/N-A, zero violations."
  },
  {
    "round_id": "r4-tasks-parallel-worktree-execution",
    "phase": "tasks",
    "started_at": "2026-09-26T12:29:11.132004+00:00",
    "ended_at": "2026-09-26T12:29:11.132004+00:00",
    "duration_seconds": 0.0,
    "input_tokens": 0,
    "output_tokens": 0,
    "total_tokens": 0,
    "work_packages_completed": 0,
    "features_completed": 0,
    "tokens_per_minute": 0.0,
    "packages_per_hour": 0.0,
    "features_per_hour": 0.0,
    "notes": "adapter does not expose token accounting; recorded 0 per protocol. Generated tasks.md: 23 tasks across Setup/Foundational/US1/US2/US3/Polish."
  },
  {
    "round_id": "r5-analyze-parallel-worktree-execution",
    "phase": "analyze",
    "started_at": "2026-09-26T00:00:00Z",
    "ended_at": "2026-09-26T00:05:00Z",
    "duration_seconds": 300.0,
    "input_tokens": 0,
    "output_tokens": 0,
    "total_tokens": 0,
    "work_packages_completed": 0,
    "features_completed": 0,
    "tokens_per_minute": 0.0,
    "packages_per_hour": 0.0,
    "features_per_hour": 0.0,
    "notes": "adapter (Claude Code) does not expose token accounting to this session; analyze repair cycle 1 closed 3 findings (spec.md Edge Case 3/SC-003 task coverage, FR-003 phase-loop isolation contract, worktree-plan mutation-semantics contract mismatch) by repairing research.md, plan.md, data-model.md, tasks.md, and contracts/cli-worktree.md directly, per PROTOCOL.md's analyze-repair override"
  },
  {
    "round_id": "r6-implement-parallel-worktree-execution",
    "phase": "implement",
    "started_at": "2026-09-26T00:05:00Z",
    "ended_at": "2026-09-26T00:25:00Z",
    "duration_seconds": 1200.0,
    "input_tokens": 0,
    "output_tokens": 0,
    "total_tokens": 0,
    "work_packages_completed": 26,
    "features_completed": 0,
    "tokens_per_minute": 0.0,
    "packages_per_hour": 78.0,
    "features_per_hour": 0.0,
    "notes": "adapter (Claude Code) does not expose token accounting to this session; implemented spec-master/lib/worktree.py (run_git, compute_waves, plan_worktree, resolve_project_root, conflicts, aggregate), spec-master/tests/test_worktree.py (11 tests, all passing), wired 'worktree waves|plan|conflicts|aggregate' into cli.py; validated against a real throwaway git repo (idempotent worktree reuse, real conflict detection) in addition to the mocked unit tests; work_packages_completed=26 counts tasks.md T001-T026"
  },
  {
    "round_id": "r7-validate-parallel-worktree-execution",
    "phase": "validate",
    "started_at": "2026-09-26T00:00:00Z",
    "ended_at": "2026-09-26T00:05:00Z",
    "duration_seconds": 300.0,
    "input_tokens": 0,
    "output_tokens": 0,
    "total_tokens": 0,
    "work_packages_completed": 3,
    "features_completed": 1,
    "tokens_per_minute": 0.0,
    "packages_per_hour": 36.0,
    "features_per_hour": 12.0,
    "notes": "Validate phase executed directly (no Spec Kit prompt template for validate) per PROTOCOL.md Sec.7. Mapped 3 acceptance criteria + 4 SC against test_worktree.py (11 tests, all passing) plus a real throwaway-git-repo smoke test. SC-001 marked PARTIAL/scope-boundary (concurrent execution driver is caller-bounded, out of this feature's plan.md scope) -- documented honestly in validation-report.md, not claimed as fully done. Feature parallel-worktree-execution now COMPLETED across all 7 phases. Token counts are 0: adapter running this session does not expose token accounting to the deterministic core."
  },
  {
    "round_id": "r8-team-mode-parallel-workstreams",
    "phase": "implement",
    "started_at": "2026-09-26T00:05:00Z",
    "ended_at": "2026-09-26T01:00:00Z",
    "duration_seconds": 3300.0,
    "input_tokens": 0,
    "output_tokens": 0,
    "total_tokens": 0,
    "work_packages_completed": 18,
    "features_completed": 1,
    "tokens_per_minute": 0.0,
    "packages_per_hour": 19.636,
    "features_per_hour": 1.091,
    "notes": "Feature 2 (team-mode-parallel-workstreams) full cycle: specify->clarify->plan->tasks->analyze(1 repair cycle: added missing US3 phase, fixed FR-007/FR-008 mis-citation)->implement(team_workstreams.py + workstreams CLI verbs, 10 new tests, full suite 160/181 pass, 21 pre-existing unrelated pytest-import errors)->validate(PASSED, no scope caveats). Zero changes to team_model.py/worktree.py or their tests (SC-004)."
  },
  {
    "round_id": "r9-speckit-tracker-orchestration",
    "phase": "implement",
    "started_at": "2026-09-26T01:00:00Z",
    "ended_at": "2026-09-26T01:45:00Z",
    "duration_seconds": 2700.0,
    "input_tokens": 0,
    "output_tokens": 0,
    "total_tokens": 0,
    "work_packages_completed": 21,
    "features_completed": 1,
    "tokens_per_minute": 0.0,
    "packages_per_hour": 28.0,
    "features_per_hour": 1.333,
    "notes": "Feature 3 (speckit-tracker-orchestration) full cycle: specify->clarify->plan->tasks->analyze(1 repair cycle: renumbered lettered task id T005a, which broke speckit-taskstoissues's own \\bT\\d{3,}\\b dedup regex)->implement(tracker_orchestration.py new module: detect_tracker_extensions()/orchestrate(), discovery.py +5 lines additive tracker_extensions field, traceability.py +issue column, cli.py 'tracker orchestrate' verb, 10 new tests, full suite 170/191 pass, 21 pre-existing unrelated pytest-import errors unchanged)->validate(PASSED, no scope caveats). Two implementation-time doc corrections applied directly: fictitious --issue CLI flag (traceability add already takes --row-json/--row-file), and FR-002's contradictory 'unknown' tracker_type enum value. Zero changes to team_model.py/worktree.py/team_workstreams.py or their tests (SC-004)."
  },
  {
    "round_id": "harness-hygiene-specify",
    "phase": "specify",
    "started_at": "2026-10-19T11:12:59Z",
    "ended_at": "2026-10-19T11:16:12Z",
    "duration_seconds": 193.0,
    "input_tokens": 0,
    "output_tokens": 0,
    "total_tokens": 0,
    "work_packages_completed": 0,
    "features_completed": 0,
    "tokens_per_minute": 0.0,
    "packages_per_hour": 0.0,
    "features_per_hour": 0.0,
    "notes": "adapter does not expose token accounting",
    "feature_id": "harness-hygiene",
    "tier": "M"
  },
  {
    "round_id": "harness-hygiene-clarify",
    "phase": "clarify",
    "started_at": "2026-10-19T11:16:18Z",
    "ended_at": "2026-10-19T11:16:31Z",
    "duration_seconds": 13.0,
    "input_tokens": 0,
    "output_tokens": 0,
    "total_tokens": 0,
    "work_packages_completed": 0,
    "features_completed": 0,
    "tokens_per_minute": 0.0,
    "packages_per_hour": 0.0,
    "features_per_hour": 0.0,
    "notes": "adapter does not expose token accounting",
    "feature_id": "harness-hygiene",
    "tier": "M"
  },
  {
    "round_id": "harness-hygiene-plan",
    "phase": "plan",
    "started_at": "2026-10-19T11:16:35Z",
    "ended_at": "2026-10-19T11:17:40Z",
    "duration_seconds": 65.0,
    "input_tokens": 0,
    "output_tokens": 0,
    "total_tokens": 0,
    "work_packages_completed": 0,
    "features_completed": 0,
    "tokens_per_minute": 0.0,
    "packages_per_hour": 0.0,
    "features_per_hour": 0.0,
    "notes": "adapter does not expose token accounting",
    "feature_id": "harness-hygiene",
    "tier": "M"
  },
  {
    "round_id": "harness-hygiene-tasks",
    "phase": "tasks",
    "started_at": "2026-10-19T11:17:48Z",
    "ended_at": "2026-10-19T11:18:13Z",
    "duration_seconds": 25.0,
    "input_tokens": 0,
    "output_tokens": 0,
    "total_tokens": 0,
    "work_packages_completed": 0,
    "features_completed": 0,
    "tokens_per_minute": 0.0,
    "packages_per_hour": 0.0,
    "features_per_hour": 0.0,
    "notes": "adapter does not expose token accounting",
    "feature_id": "harness-hygiene",
    "tier": "M"
  },
  {
    "round_id": "harness-hygiene-analyze",
    "phase": "analyze",
    "started_at": "2026-10-19T11:18:13Z",
    "ended_at": "2026-10-19T11:18:45Z",
    "duration_seconds": 32.0,
    "input_tokens": 0,
    "output_tokens": 0,
    "total_tokens": 0,
    "work_packages_completed": 0,
    "features_completed": 0,
    "tokens_per_minute": 0.0,
    "packages_per_hour": 0.0,
    "features_per_hour": 0.0,